{
  "schema_version": "1.1.0",
  "registry_id": "appfusion-project-registry",
  "registry_revision": 24,
  "updated_at": "2026-09-04T09:42:48Z",
  "state_authority": {
    "primary": "GIT_EVENT_LEDGER",
    "drive_control_folder_id": "1yrcp--SXTWKXKPsimFVlgrMhKLKxftdw",
    "drive_registry_file_id": "15-oC17tb-17N_5h6vKsYGct7_D_xGGqI",
    "github_mirror": "jawadresearchai-creator/appfusion-coscientist:state/APPFUSION_PROJECT_REGISTRY.json",
    "git_event_ledger": "jawadresearchai-creator/appfusion-coscientist:state/events",
    "drive_projection_policy": "AFTER_VALID_GIT_TRANSITION",
    "mirror_policy": "DRIVE_PROJECTION_AFTER_GIT_COMMIT",
    "conflict_policy": "FAST_FORWARD_EVENT_LEDGER_ELSE_PAUSE"
  },
  "system": {
    "system_id": "appfusion-coscientist",
    "status": "READY",
    "phase": "PRODUCT_CONSTRUCTION",
    "current_milestone": "PROJECT_A_WORKFLOW_RESTORED_J2_RESUMED",
    "last_completed_event": {
      "event_type": "PROJECT_A_WORKFLOW_RESTORED_J2_RESUMED",
      "occurred_at": "2026-09-04T09:42:48Z",
      "summary": "Removed only .github/workflows/aleil-ios-test.yml from the public Project A Product repository under explicit user authorization, after the user reported Project B migration verified. Cleanup d8844ed95285117e6688dd0866974b7d74177d43 preserves product-construction-ci.yml byte-for-byte and restores the exact full Git tree tested at J1 source 1c6ab92f25a281a6776c7899645917d21695765f. All 24 local boundary/harness checks and hosted preflight 33859586693 pass. Unchanged platform jobs were intentionally skipped, not counted as new passes; revision 23 J1 evidence and release remain preserved. Project A resumes locked J2 construction. The dedicated Project B repository and Drive state were not accessed or modified."
    },
    "next_safe_action": "Implement and verify locked J2 activity/cadence/reminder persistence, deterministic restart/timezone behavior, and installed Android/iOS journeys in the Project A public Product repository using its single guarded standard-public workflow. Preserve J1 and revision 23 evidence. After J2, continue J3 and final security/release gates. Do not access Project B/ALEIL worker repository or Drive state. No billing, paid services, private CI reactivation or mandatory local executor.",
    "blockers": []
  },
  "applications": [
    {
      "schema_version": "1.1.0",
      "app_id": "docvault-lasttime-fusion",
      "display_name": "DocVault + LastTime Fusion",
      "active_for_selection": true,
      "lifecycle_state": "PRODUCT_CONSTRUCTION",
      "phase": "J2_ACTIVITY_REMINDERS_IMPLEMENTATION_REQUIRED",
      "updated_at": "2026-09-04T09:42:48Z",
      "state_revision": 24,
      "last_event_sequence": 24,
      "delivery_plan_id": "docvault-lasttime-fusion-v0.1",
      "last_completed_event": {
        "event_type": "PROJECT_A_WORKFLOW_RESTORED_J2_RESUMED",
        "occurred_at": "2026-09-04T09:42:48Z",
        "summary": "Removed only .github/workflows/aleil-ios-test.yml from the public Project A Product repository under explicit user authorization, after the user reported Project B migration verified. Cleanup d8844ed95285117e6688dd0866974b7d74177d43 preserves product-construction-ci.yml byte-for-byte and restores the exact full Git tree tested at J1 source 1c6ab92f25a281a6776c7899645917d21695765f. All 24 local boundary/harness checks and hosted preflight 33859586693 pass. Unchanged platform jobs were intentionally skipped, not counted as new passes; revision 23 J1 evidence and release remain preserved. Project A resumes locked J2 construction. The dedicated Project B repository and Drive state were not accessed or modified."
      },
      "next_safe_action": "Implement and verify locked J2 activity/cadence/reminder persistence, deterministic restart/timezone behavior, and installed Android/iOS journeys in the Project A public Product repository using its single guarded standard-public workflow. Preserve J1 and revision 23 evidence. After J2, continue J3 and final security/release gates. Do not access Project B/ALEIL worker repository or Drive state. No billing, paid services, private CI reactivation or mandatory local executor.",
      "blockers": [],
      "artifact_locations": {
        "product_repository": "jawadresearchai-creator/appfusion-product-public",
        "drive_workspace_id": "1QGCWL7rabO2NuXm83xKXrNaGLvnXsvpt",
        "source_bundle_manifest_file_id": "12Qjms57CorUzpMqPrQ9dh8TrS3slxN5M",
        "application_state_file_id": "1kurtVziDCgOGXvPujRaW5JrYPBQ9SkgX",
        "product_blueprint_sha256": "2120f5989ec35562377bd42e032018bd0004916d5ea4c56005f8e7048414b6fc"
      }
    }
  ],
  "selection_policy": {
    "zero_active": "REPORT_NONE_AND_REQUEST_REGISTRATION",
    "one_active": "AUTO_SELECT_AND_RESUME",
    "multiple_active": "ASK_USER_TO_SELECT"
  }
}
